"PublisherIC";"PublisherName";"Region";"NumberOfEmployees"
241717;"MĚSTSKÁ ČÁST PRAHA - ŠEBEROV";"Praha";6
244309;"Město Rakovník";"Středočeský kraj";250
246476;"Město Dačice";"Jihočeský kraj";100
252921;"MĚSTO SOBĚSLAV";"Jihočeský kraj";50
253014;"Město Tábor";"Jihočeský kraj";250
260428;"Město Česká Lípa";"Liberecký kraj";250
262633;"MĚSTO ŽELEZNÝ BROD";"Liberecký kraj";100
262781;"MĚSTO FRÝDLANT";"Liberecký kraj";100
265365;"Město Podbořany";"Ústecký kraj";100
265781;"Město Žatec";"Ústecký kraj";100
266094;"Statutární město Most";"Ústecký kraj";500
266230;"Město Bílina";"Ústecký kraj";200
272523;"Město Broumov";"Královéhradecký kraj";100
274101;"Město Přelouč";"Pardubický kraj";100
274879;"Město Dobruška";"Královéhradecký kraj";100
277819;"Město Dvůr Králové nad Labem";"Královéhradecký kraj";100
279676;"Město Ústí nad Orlicí";"Pardubický kraj";100
279846;"Město Žamberk";"Pardubický kraj";100
281964;"Město Kuřim";"Jihomoravský kraj";100
282979;"Město Židlochovice";"Jihomoravský kraj";100
283924;"Statutární město Zlín";"Zlínský kraj";500
284611;"Město Valašské Klobouky";"Zlínský kraj";50
286010;"Statutární město Jihlava";"Kraj Vysočina";500
289965;"MĚSTO NÁMĚŠŤ NAD OSLAVOU";"Kraj Vysočina";50
291676;"Město Bučovice";"Jihomoravský kraj";100
296317;"Město Rýmařov";"Moravskoslezský kraj";50
297569;"Město Bohumín";"Moravskoslezský kraj";200
298221;"Město Odry";"Moravskoslezský kraj";100
299138;"Město Litovel";"Olomoucký kraj";100
300292;"Město Kravaře";"Moravskoslezský kraj";100
301825;"Statutární město Přerov";"Olomoucký kraj";250
303640;"Město Zábřeh";"Olomoucký kraj";100
371149;"Muzeum a galerie Orlických hor v Rychnově nad Kněžnou";"Královéhradecký kraj";20
380385;"Střední škola informatiky, poštovnictví a finančnictví Brno, příspěvková organizace";"Jihomoravský kraj";200
396036;"Jihočeská filharmonie";"Jihočeský kraj";50
400921;"Centrum experimentálního divadla, příspěvková organizace";"Jihomoravský kraj";100
401081;"Gymnázium, Ústí nad Orlicí, T.G.Masaryka 106";"Pardubický kraj";25
495433;"Střední škola gastronomie a farmářství Jeseník";"Olomoucký kraj";50
497029;"Střední odborná škola mediální grafiky a polygrafie, Rumburk, příspěvková organizace";"Ústecký kraj";25
526517;"Střední škola strojní, stavební a dopravní, Liberec II, Truhlářská 360/3, příspěvková organizace";"Liberecký kraj";100
533874;"Divadlo loutek Ostrava, příspěvková organizace";"Moravskoslezský kraj";50
556807;"Střední škola řemesel a služeb, Děčín IV, Ruská 147, příspěvková organizace";"Ústecký kraj";50
559105;"Gymnázium Zlín - Lesní čtvrť";"Zlínský kraj";100
582336;"Střední škola polytechnická, České Budějovice, Nerudova 59";"Jihočeský kraj";50
583171;"Správa Národního parku Šumava";"Plzeňský kraj";250
601675;"Gymnázium, Nový Jičín, příspěvková organizace";"Moravskoslezský kraj";50
601799;"Gymnázium, Olomouc - Hejčín, Tomkova 45";"Olomoucký kraj";100
638463;"Českoslovanská akademie obchodní Dr.Edvarda Beneše, střední odborná škola, Praha 2, Resslova 8";"Praha";50
666262;"Domov důchodců Dobrá Voda";"Jihočeský kraj";200
829137;"Psychiatrická léčebna Petrohrad, příspěvková organizace";"Ústecký kraj";100
836591;"Obchodní akademie, Střední zdravotnická škola, Střední odborná škola služeb a Jazyková škola s právem státní jazykové zkoušky Jihlava";"Kraj Vysočina";100
843474;"Střední škola informatiky, elektrotechniky a řemesel Rožnov pod Radhoštěm";"Zlínský kraj";100
844071;"Střední škola, základní škola a mateřská škola pro sluchově postižené, Olomouc, Kosmonautů 4";"Olomoucký kraj";50
844641;"Sdružené zdravotnické zařízení Krnov, příspěvková organizace";"Moravskoslezský kraj";500
844691;"Střední odborná škola, Frýdek-Místek, příspěvková organizace";"Moravskoslezský kraj";100
848794;"Střední odborná škola lesnická a strojírenská Šternberk";"Olomoucký kraj";50
852082;"Středisko volného času a zařízení pro další vzdělávání pedagogických pracovníků Doris Šumperk";"Olomoucký kraj";50
872113;"Správa přírodních léčivých zdrojů a kolonád, příspěvková organizace";"Karlovarský kraj";20
873624;"Domov Na Hrádku, poskytovatel sociálních služeb";"Středočeský kraj";50
873667;"Městské sociální a zdravotní služby";"Středočeský kraj";50
873764;"Městská nemocnice Čáslav";"Středočeský kraj";250
879444;"Nemocnice Na Františku";"Praha";500
3299864;"Technické služby Zlínsko, s.r.o.";"Zlínský kraj";10
3447286;"Technická správa komunikací hl. m. Prahy, a.s.";"Praha";250
4095316;"Centrum pro regionální rozvoj České republiky";"Praha";500
4618751;"Hokejový klub Opava s.r.o.";"Moravskoslezský kraj";6
13582143;"Galerie výtvarného umění v Havlíčkově Brodě";"Kraj Vysočina";10
13583212;"Domov bez bariér";"Královéhradecký kraj";50
13642103;"Státní veterinární ústav Olomouc";"Olomoucký kraj";100
13691554;"Státní veterinární ústav Jihlava";"Kraj Vysočina";100
14450216;"Horské lázně Karlova Studánka, státní podnik";"Moravskoslezský kraj";100
14450356;"Střední průmyslová škola, Hronov, Hostovského 910";"Královéhradecký kraj";25
14451093;"Střední škola technická a dopravní, Ostrava-Vítkovice, příspěvková organizace";"Moravskoslezský kraj";50
14618141;"Základní škola a mateřská škola Hranice, Šromotovo, příspěvková organizace";"Olomoucký kraj";50
14803844;"Střední odborné učiliště, Sedlčany, Petra Bezruče 364";"Středočeský kraj";50
16980123;"Střední průmyslová škola Emila Kolbena Rakovník, příspěvková organizace";"Středočeský kraj";25
24272523;"Vojenský technický ústav, s.p.";"Praha";250
25144251;"DOKAS Dobříš, s.r.o.";"Středočeský kraj";50
25259661;"Městská teplárenská Turnov, s.r.o.";"Liberecký kraj";6
25267213;"Dopravní podnik města Hradce Králové, a.s.";"Královéhradecký kraj";250
25291408;"Rozvojový fond Pardubice a.s.";"Pardubický kraj";25
25376021;"SLUMEKO, s.r.o.";"Moravskoslezský kraj";50
25512285;"Technické sítě Brno, akciová společnost";"Jihomoravský kraj";100
25632141;"Střední průmyslová škola dopravní, a.s.";"Praha";100
25672541;"Technologie Hlavního města Prahy, a.s.";"Praha";20
25896903;"EKO servis Zábřeh s.r.o.";"Olomoucký kraj";50
26093545;"Jihočeské letiště České Budějovice a.s.";"Jihočeský kraj";25
26286173;"Technické služby Blansko, s.r.o.";"Jihomoravský kraj";25
26330725;"INFOCENTRUM MĚSTA Karlovy Vary, o.p.s.";"Karlovarský kraj";10
26402068;"Údržba silnic Karlovarského kraje, a.s.";"Karlovarský kraj";200
26815982;"BOSPOR spol. s r.o.";"Moravskoslezský kraj";50
26829495;"Sportplex Frýdek-Místek, s.r.o.";"Moravskoslezský kraj";50
27549704;"Vodárenská Svitavy s.r.o.";"Pardubický kraj";20
27761746;"Pink market s.r.o.";"Praha";1
28762886;"Nemocnice Nymburk s.r.o.";"Středočeský kraj";500
28776658;"Správa nemovitostí města Jičína, a.s.";"Královéhradecký kraj";20
44555296;"Domov pro seniory Chlumec, příspěvková organizace";"Ústecký kraj";50
44555601;"Univerzita Jana Evangelisty Purkyně v Ústí nad Labem";"Ústecký kraj";1000
45242810;"Základní škola, Praha 4, Bítovská 1";"Praha";50
45247650;"Lesy hl.m. Prahy";"Praha";250
45768455;"Národní institut pro další vzdělávání / zařízení pro další vzdělávání pedagogických pracovníků /";"Praha";250
46254323;"Základní umělecká škola Uherské Hradiště";"Zlínský kraj";50
46390367;"Základní škola Kolín II., Bezručova 980";"Středočeský kraj";50
46773401;"Základní škola Litoměřice, U Stadionu 4";"Ústecký kraj";50
46789707;"Základní škola Chomutov, Kadaňská 2334";"Ústecký kraj";50
46789979;"Základní škola, ul. Školní 1479, okr. Chomutov";"Ústecký kraj";25
46937099;"Centrum služeb pro seniory Kyjov, příspěvková organizace";"Jihomoravský kraj";100
47011343;"Základní škola Jindřicha Matiegky Mělník, příspěvková organizace";"Středočeský kraj";50
47236574;"Zeměměřický a katastrální inspektorát v Českých Budějovicích";"Jihočeský kraj";6
47487259;"Základní umělecká škola Bedřicha Smetany Litomyšl";"Pardubický kraj";25
47608579;"Masarykova základní škola, Praha 9 - Újezd nad Lesy, Polesná 1690";"Praha";100
47672234;"Česká průmyslová zdravotní pojišťovna";"Moravskoslezský kraj";500
47674954;"Vodohospodářská zařízení Šumperk, a.s.";"Olomoucký kraj";20
47934409;"Základní škola Slovan, Kroměříž, příspěvková organizace";"Zlínský kraj";100
47973145;"AKORD & POKLAD, s.r.o.";"Moravskoslezský kraj";25
48004545;"Základní škola a Mateřská škola Školská, Karviná, příspěvková organizace";"Moravskoslezský kraj";25
48135097;"Úřad průmyslového vlastnictví";"Praha";200
48145122;"Zdravotnická záchranná služba Královéhradeckého kraje";"Královéhradecký kraj";250
48199931;"Zdravotnická záchranná služba Jihočeského kraje";"Jihočeský kraj";500
48342998;"Výchovný ústav, dětský domov se školou, základní škola, střední škola a školní jídelna, Hostouň, Chodské náměstí 131";"Plzeňský kraj";100
48683035;"Městské divadlo Mladá Boleslav";"Středočeský kraj";50
49056689;"Technické služby města Pelhřimova, příspěvková organizace";"Kraj Vysočina";100
49466984;"Školní jídelna Heyrovského 32, 635 00 Brno, příspěvková organizace";"Jihomoravský kraj";6
49558668;"Mateřská škola Míček, Hranice, příspěvková organizace";"Olomoucký kraj";10
49562827;"Sociální služby Vsetín, příspěvková organizace";"Zlínský kraj";250
49777696;"11. školní jídelna Plzeň, Baarova 31, příspěvková organizace";"Plzeňský kraj";20
49778145;"Gymnázium, Plzeň, Mikulášské nám. 23";"Plzeňský kraj";50
49778200;"Základní škola a Mateřská škola pro zrakově postižené a vady řeči, Plzeň, Lazaretní 25";"Plzeňský kraj";50
60076046;"Obchodní akademie, České Budějovice, Husova 1";"Jihočeský kraj";25
60108711;"Vodovody a kanalizace Trutnov, a.s.";"Královéhradecký kraj";50
60112476;"HOCKEY CLUB DYNAMO PARDUBICE a.s.";"Pardubický kraj";6
60126671;"Vyšší odborná škola, Obchodní akademie a Střední odborné učiliště technické Chotěboř";"Kraj Vysočina";50
60458500;"Zeměměřický úřad";"Praha";250
60461373;"Vysoká škola chemicko-technologická v Praze";"Praha";1500
60545984;"Gymnázium Jihlava";"Kraj Vysočina";50
60552255;"Střední škola Brno, Charbulova, příspěvková organizace";"Jihomoravský kraj";250
60680318;"Střední vinařská škola Valtice, příspěvková organizace";"Jihomoravský kraj";50
60713470;"SAKO Brno, a.s.";"Jihomoravský kraj";250
60884703;"Gymnázium Františka Martina Pelcla, Rychnov nad Kněžnou, Hrdinů odboje 36";"Královéhradecký kraj";25
61345741;"Výchovný ústav,dětský domov se školou,základní škola,střední škola a školní jídelna,Místo 66";"Ústecký kraj";50
61386308;"Diagnostický ústav a Středisko výchovné péče, Praha 4, Na Dlouhé mezi 19";"Praha";100
61387142;"Národní technická knihovna";"Praha";200
61387169;"Národní pedagogické muzeum a knihovna J.A. Komenského";"Praha";50
61388424;"Základní škola s rozšířenou výukou jazyků, Praha 4, K Milíčovu 674";"Praha";100
61388955;"Ústav fyzikální chemie J. Heyrovského AV ČR, v.v.i.";"Praha";250
61389013;"Ústav makromolekulární chemie AV ČR, v.v.i.";"Praha";250
61389820;"Základní škola Praha 7, Korunovační 8";"Praha";100
61459445;"ČD - Telematika a.s.";"Praha";500
61986038;"Střední lesnická škola, Hranice, Jurikova 588";"Olomoucký kraj";50
62073176;"Obchodní akademie a Střední zdravotnická škola Blansko, příspěvková organizace";"Jihomoravský kraj";25
62180444;"SENIOR Otrokovice,příspěvková organizace";"Zlínský kraj";100
62502573;"BYTES Tábor s.r.o.";"Jihočeský kraj";50
62690281;"Střední odborná škola veterinární, Hradec Králové - Kukleny, Pražská 68";"Královéhradecký kraj";25
62690361;"Vyšší odborná škola, Střední škola, Základní škola a Mateřská škola, Hradec Králové, Štefánikova 549";"Královéhradecký kraj";200
63322528;"ST SERVIS s.r.o.";"Zlínský kraj";25
63609291;"Dětský domov Polička";"Pardubický kraj";20
63831333;"Základní škola a mateřská škola, Praha 3, Chelčického 43/2614";"Praha";100
64053466;"Dopravní podnik měst Chomutova a Jirkova a.s.";"Ústecký kraj";100
64087662;"T E R M O  Frýdlant n.O. s.r.o.";"Moravskoslezský kraj";25
64422402;"Vyšší policejní škola a Střední policejní škola Ministerstva vnitra v Holešově";"Zlínský kraj";100
64610250;"Městský dopravní podnik Opava, a.s.";"Moravskoslezský kraj";100
64628205;"Základní škola, Ostrava - Mariánské Hory, Karasova 6, příspěvková organizace";"Moravskoslezský kraj";25
64650596;"Tepelné hospodářství města Lovosic s.r.o.";"Ústecký kraj";6
64650871;"Žatecká teplárenská, a.s.";"Ústecký kraj";25
65639669;"Základní škola Teplice, Edisonova 1732";"Ústecký kraj";50
66739331;"Technické služby Ostrava-Jih, příspěvková organizace";"Moravskoslezský kraj";100
67365779;"Dům dětí a mládeže Praha 9";"Praha";25
67673015;"Základní umělecká škola B.M. Černohorského, Nymburk, Palackého třída 574";"Středočeský kraj";25
67779999;"Zařízení služeb pro Ministerstvo vnitra";"Praha";1000
67985815;"Astronomický ústav AV ČR,v.v.i";"Středočeský kraj";100
67985858;"Ústav chemických procesů AV ČR, v.v.i.";"Praha";200
68081723;"Ústav fyziky materiálů AV ČR, v.v.i.";"Jihomoravský kraj";100
68081740;"Psychologický ústav AV ČR, v.v.i.";"Jihomoravský kraj";25
68334265;"Základní škola Jablunkov, Lesní 190, příspěvková organizace";"Moravskoslezský kraj";50
68403569;"NÁRODNÍ BEZPEČNOSTNÍ ÚŘAD";"Praha";250
70107416;"Základní škola a mateřská škola Praha 5 - Smíchov, Kořenského 10/760";"Praha";50
70226369;"Městská knihovna Litvínov";"Ústecký kraj";10
70828121;"Základní umělecká škola Blovice, okres Plzeň-jih";"Plzeňský kraj";10
70835144;"Dětský domov a školní jídelna, Sedloňov 153";"Královéhradecký kraj";25
70875413;"Dětské centrum Paprsek";"Praha";100
70882525;"Hasičský záchranný sbor Královéhradeckého kraje";"Královéhradecký kraj";500
70888744;"Hasičský záchranný sbor Libereckého kraje";"Liberecký kraj";250
70889988;"Povodí Ohře, státní podnik";"Ústecký kraj";500
70892326;"Pečovatelská služba Praha 3";"Praha";50
70932301;"Základní škola a Mateřská škola Uherský Brod-Újezdec, příspěvková organizace";"Zlínský kraj";10
70932581;"Správa a údržba silnic Jihomoravského kraje, příspěvková organizace kraje";"Jihomoravský kraj";500
70960399;"Správa silnic Olomouckého kraje, příspěvková organizace";"Olomoucký kraj";250
70961808;"Justiční akademie";"Zlínský kraj";50
70979464;"Státní oblastní archiv v Litoměřicích";"Ústecký kraj";100
70984182;"Mateřská škola Ostrava - Mariánské Hory, Gen. Janka 1/1236, příspěvková organizace";"Moravskoslezský kraj";10
71009159;"Krajská hygienická stanice Středočeského kraje se sídlem v Praze";"Praha";250
71009183;"Krajská hygienická stanice Ústeckého kraje se sídlem v Ústí nad Labem";"Ústecký kraj";100
71184473;"Domov Kamélie Křižanov, příspěvková organizace";"Jihomoravský kraj";100
71212311;"Školní jídelna, Praha 10, Vršovická 68/1429, příspěvková organizace";"Praha";100
71214011;"GENERÁLNÍ ŘEDITELSTVÍ CEL";"Praha";5000
71229051;"Vyšší Hrádek, poskytovatel sociálních služeb";"Středočeský kraj";100
71234411;"Domov Unhošť, poskytovatel sociálních služeb";"Středočeský kraj";50
71234438;"Bellevue, poskytovatel sociálních služeb";"Středočeský kraj";50
71294767;"Dům dětí a mládeže Kyjov, příspěvková organizace města Kyjova";"Jihomoravský kraj";10
71377999;"Agentura pro podporu podnikání a investic CzechInvest";"Praha";250
72046635;"Centrální nákup, příspěvková organizace";"Plzeňský kraj";10
72049537;"Společenské centrum Trutnovska pro kulturu a volný čas";"Královéhradecký kraj";50
72053682;"Kultura Žďár, příspěvková organizace";"Kraj Vysočina";10
72080043;"Generální finanční ředitelství";"Praha";10000
72742364;"Mateřská škola, Most, Lidická 44, příspěvková organizace";"Ústecký kraj";100
72742909;"Mateřská škola, Liberec, Jeřmanická 487/27, příspěvková organizace";"Liberecký kraj";10
75004054;"Domov Paprsek Olšany, příspěvková organizace";"Olomoucký kraj";50
75031957;"Mateřská škola Brno, Hudcova 435/47, příspěvková organizace";"Jihomoravský kraj";25
75037947;"Městské muzeum Rýmařov, příspěvková organizace";"Moravskoslezský kraj";10
75075741;"Národní zemědělské muzeum, s.p.o.";"Praha";100
75081849;"Sociální služby Lanškroun";"Pardubický kraj";50
75089424;"Dům dětí a mládeže, Třinec, příspěvková organizace";"Moravskoslezský kraj";10
75139243;"Domov seniorů Havířov, příspěvková organizace";"Moravskoslezský kraj";200
75151499;"Krajské ředitelství policie Jihomoravského kraje";"Jihomoravský kraj";4000
75151511;"Krajské ředitelství policie Jihočeského kraje";"Jihočeský kraj";2500
20699;"Český hydrometeorologický ústav";"Praha";500
23221;"Národní knihovna České republiky";"Praha";500
23817;"Státní ústav pro kontrolu léčiv";"Praha";500
24406;"Obvodní soud pro Prahu 3";"Praha";50
24490;"Okresní soud v Benešově";"Středočeský kraj";50
24783;"Okresní soud v Rokycanech";"Plzeňský kraj";25
24856;"Okresní soud v Jablonci nad Nisou";"Liberecký kraj";50
24911;"Okresní soud v Ústí nad Labem";"Ústecký kraj";100
25054;"Okresní soud v Blansku";"Jihomoravský kraj";50
25089;"Okresní soud v Břeclavi";"Jihomoravský kraj";50
25101;"Okresní soud v Hodoníně";"Jihomoravský kraj";50
25151;"Okresní soud v Uherském Hradišti";"Zlínský kraj";50
25208;"Okresní soud v Bruntále";"Moravskoslezský kraj";100
25291;"Okresní soud ve Vsetíně";"Zlínský kraj";50
26026;"Krajské státní zastupitelství v Českých Budějovicích";"Jihočeský kraj";100
27251;"Ústav zemědělské ekonomiky a informací";"Praha";250
56324;"Střední škola André Citroëna Boskovice, příspěvková organizace";"Jihomoravský kraj";50
57266;"NÁRODNÍ FILMOVÝ ARCHIV";"Praha";100
64173;"Fakultní nemocnice Královské Vinohrady";"Praha";3000
64327;"Švandovo divadlo na Smíchově";"Praha";100
64475;"Symfonický orchestr hlavního města Prahy FOK";"Praha";100
64581;"Hlavní město Praha";"Praha";4000
66001;"Krajská správa a údržba silnic Středočeského kraje, příspěvková organizace";"Praha";100
66567;"Regionální muzeum Mělník, příspěvková organizace";"Středočeský kraj";20
69841;"Polabské muzeum, příspěvková organizace";"Středočeský kraj";25
72583;"Školní statek, Humpolec, Dusilov 384";"Kraj Vysočina";50
73504;"Jihočeská vědecká knihovna v Českých Budějovicích";"Jihočeský kraj";100
74942;"Technické služby města Klatov, příspěvková organizace";"Plzeňský kraj";100
75710;"Muzeum jižního Plzeňska v Blovicích, příspěvková organizace";"Plzeňský kraj";10
77879;"Střední škola, Bor, Plzeňská 231";"Plzeňský kraj";25
79065;"Technické služby města Chomutova, příspěvková organizace";"Ústecký kraj";100
81582;"Zoologická zahrada Ústí nad Labem, příspěvková organizace";"Ústecký kraj";50
82554;"Střední škola hospodářská a lesnická, Frýdlant, Bělíkova 1387, příspěvková organizace";"Liberecký kraj";100
83232;"Severočeské muzeum v Liberci, příspěvková organizace";"Liberecký kraj";50
85031;"Správa a údržba silnic Pardubického kraje";"Pardubický kraj";250
91120;"Knihovna Kroměřížska - příspěvková organizace";"Zlínský kraj";25
92142;"Muzeum Jana Amose Komenského v Uherském Brodě";"Zlínský kraj";25
92738;"Jihomoravské muzeum ve Znojmě,příspěvková organizace";"Jihomoravský kraj";25
95354;"Muzeum v Bruntále, příspěvková organizace";"Moravskoslezský kraj";25
101443;"Hvězdárna a planetárium Brno, příspěvková organizace";"Jihomoravský kraj";20
194913;"Domov Důchodců Tmavý Důl";"Královéhradecký kraj";50
209805;"Masarykův onkologický ústav";"Jihomoravský kraj";1000
213713;"Katastrální úřad pro Liberecký kraj";"Liberecký kraj";100
213721;"Katastrální úřad pro Pardubický kraj";"Pardubický kraj";250
226475;"Střední škola technická a ekonomická Brno, Olomoucká, příspěvková organizace";"Jihomoravský kraj";100
231401;"Město Benešov";"Středočeský kraj";200
240079;"Město Brandýs nad Labem-Stará Boleslav";"Středočeský kraj";250
240346;"MĚSTSKÁ ČÁST PRAHA - KOLOVRATY";"Praha";20
240711;"MĚSTSKÁ ČÁST PRAHA - SATALICE";"Praha";10
244732;"Statutární město České Budějovice";"Jihočeský kraj";500
245941;"Město Kaplice";"Jihočeský kraj";50
248801;"Město Pelhřimov";"Kraj Vysočina";100
250627;"Město Prachatice";"Jihočeský kraj";100
250996;"Město Blatná";"Jihočeský kraj";50
258199;"Město Nýřany";"Plzeňský kraj";100
259438;"Město Kraslice";"Karlovarský kraj";50
261602;"Město Rumburk";"Ústecký kraj";100
262587;"MĚSTO TANVALD";"Liberecký kraj";100
263958;"Město Litoměřice";"Ústecký kraj";200
263991;"Město Lovosice";"Ústecký kraj";100
272876;"Město Nové Město nad Metují";"Královéhradecký kraj";100
275808;"Město Jilemnice";"Liberecký kraj";100
277177;"Město Polička";"Pardubický kraj";100
283347;"Město Mikulov";"Jihomoravský kraj";50
284653;"Město Vizovice";"Zlínský kraj";50
286745;"MĚSTO TELČ";"Kraj Vysočina";50
293199;"Město Moravský Krumlov";"Jihomoravský kraj";50
294900;"Město Nové Město na Moravě";"Kraj Vysočina";100
295892;"Město Bruntál";"Moravskoslezský kraj";200
297437;"Město Český Těšín";"Moravskoslezský kraj";100
297755;"Město Bílovec";"Moravskoslezský kraj";100
303461;"Město Šumperk";"Olomoucký kraj";200
304271;"Město Rožnov pod Radhoštěm";"Zlínský kraj";200
368512;"Sušické kulturní centrum - SIRKUS, příspěvková organizace";"Plzeňský kraj";25
377678;"Městský dům kultury Sokolov, příspěvková organizace";"Karlovarský kraj";25
377805;"Centrum sociálních služeb Tachov, příspěvková organizace";"Plzeňský kraj";100
405698;"Fond dalšího vzdělávání";"Praha";250
511668;"Domov Lidmaň, příspěvková organizace";"Kraj Vysočina";50
534242;"Nemocnice Třinec, příspěvková organizace";"Moravskoslezský kraj";1000
601250;"Městská knihovna Havířov";"Moravskoslezský kraj";25
601322;"Střední průmyslová škola a Obchodní akademie, Bruntál, příspěvková organizace";"Moravskoslezský kraj";50
601667;"Gymnázium Mikuláše Koperníka, Bílovec, příspěvková organizace";"Moravskoslezský kraj";50
602051;"Střední umělecká škola, Ostrava, příspěvková organizace";"Moravskoslezský kraj";50
635162;"Městská nemocnice Ostrava, příspěvková organizace";"Moravskoslezský kraj";2000
638994;"ČESKÁ ŠKOLNÍ INSPEKCE";"Praha";500
666271;"Domov Libníč a Centrum sociálních služeb Empatie";"Jihočeský kraj";100
669792;"Psychiatrická nemocnice v Dobřanech";"Plzeňský kraj";1000
671045;"Dětský domov Trnová, příspěvková organizace";"Plzeňský kraj";25
842753;"Gymnázium Hladnov a Jazyková škola s právem státní jazykové zkoušky, Ostrava, příspěvková organizace";"Moravskoslezský kraj";50
849103;"Zdravotnická záchranná služba Olomouckého kraje, příspěvková organizace";"Olomoucký kraj";250
851817;"Masarykova veřejná knihovna Vsetín";"Zlínský kraj";25
856070;"Gymnázium Ivana Olbrachta, Semily, Nad Špejcharem 574, příspěvková organizace";"Liberecký kraj";50
2013762;"Střední průmyslová škola elektrotechnická a Vyšší odborná škola Pardubice";"Pardubický kraj";100
2795281;"Operátor ICT, a.s.";"Praha";100
4212371;"Správa tepelného hospodářství MČ Praha 8 s.r.o.";"Praha";1
14798425;"Střední odborná škola a Střední odborné učiliště, Vlašim, Zámek 1";"Středočeský kraj";50
15034569;"Střední odborné učiliště Svitavy";"Pardubický kraj";25
16577434;"Městské kulturní centrum Poděbrady";"Středočeský kraj";6
16977246;"Střední odborná škola a Střední odborné učiliště, Kladno, Dubská";"Středočeský kraj";100
18383874;"Vyšší odborná škola, Střední průmyslová škola a Střední odborná škola služeb a cestovního ruchu, Varnsdorf, Bratislavská 2166, příspěvková organizace";"Ústecký kraj";200
19013833;"Střední škola technická, Přerov, Kouřílkova 8";"Olomoucký kraj";50
21551189;"Základní umělecká škola, Vysoké Mýto, příspěvková organizace";"Pardubický kraj";25
25073249;"Údržba městských komunikací Rakovník ,spol. s r.o.";"Středočeský kraj";25
25379631;"Moravskoslezské inovační centrum Ostrava, a.s.";"Moravskoslezský kraj";25
25450131;"Liberecká IS, a.s.";NA;25
25479300;"Nemocnice Kadaň s.r.o.";"Ústecký kraj";250
25543571;"TEPLO Břeclav s.r.o.";"Jihomoravský kraj";20
25656112;"Pražská vodohospodářská společnost a.s.";"Praha";100
25857568;"OVANET a.s.";"Moravskoslezský kraj";50
25962523;"Městské lesy Hradec Králové a.s.";"Královéhradecký kraj";25
26944855;"Služby Boskovice,s.r.o.";"Jihomoravský kraj";50
27145573;"Czech Airlines Technics, a.s.";"Praha";500
28199081;"Jihoměstská majetková a.s.";"Praha";100
28825781;"PAP PARDUBICE o.p.s.";"Pardubický kraj";50
29099846;"POVED s. r. o.";"Plzeňský kraj";10
42660424;"ZOO PARK Vyškov, příspěvková organizace";"Jihomoravský kraj";25
44225831;"Zeměměřický a katastrální inspektorát v Liberci";"Liberecký kraj";10
