"PublisherIC";"PublisherName";"Region";"NumberOfEmployees"
44555288;"Domov pro seniory Velké Březno, příspěvková organizace";"Ústecký kraj";50
44685173;"Domov Jílové u Prahy, poskytovatel sociálních služeb";"Středočeský kraj";25
44994575;"Centrum dopravního výzkumu, v.v.i.";"Jihomoravský kraj";200
45245053;"ČESKÝ ROZHLAS";"Praha";1500
45251002;"Rada pro rozhlasové a televizní vysílání";"Praha";50
45354774;"BIC Plzeň, společnost s ručením omezeným";"Plzeňský kraj";10
46070753;"Základní škola s rozšířeným vyučováním matematiky a přírodovědných předmětů, Teplice, Buzulucká 392";"Ústecký kraj";50
46271040;"Základní škola Vyškov, Morávkova 40, příspěvková organizace";"Jihomoravský kraj";25
46354182;"Zaměstnanecká pojišťovna Škoda";"Středočeský kraj";50
46390375;"Základní umělecká škola Fr.Kmocha";"Středočeský kraj";50
46764593;"Základní škola a Mateřská škola, Žatec, Dvořákova 24, okres Louny";"Ústecký kraj";25
46789731;"Základní škola Chomutov, Školní 1480";"Ústecký kraj";50
46789766;"Základní škola Chomutov, Březenecká 4679";"Ústecký kraj";50
46789944;"Sociální služby Chomutov, příspěvková organizace";"Ústecký kraj";200
46937102;"S - centrum Hodonín, příspěvková organizace";"Jihomoravský kraj";100
47150904;"Vodohospodářská společnost ČERLINKA s.r.o.";"Olomoucký kraj";25
47151595;"Dům kultury  města Ostravy, a.s.";"Moravskoslezský kraj";50
47274573;"Domovy pro seniory Šluknov - Krásná Lípa, příspěvková organizace";"Ústecký kraj";100
47610361;"Základní škola u svatého Štěpána, Praha 2, Štěpánská 8 příspěvková organizace";"Praha";25
47657022;"Základní škola Olomouc, Heyrovského 33, příspěvková organizace";"Olomoucký kraj";100
47672315;"BM servis a.s.";"Moravskoslezský kraj";200
47813148;"Střední průmyslová škola stavební, Opava, příspěvková organizace";"Moravskoslezský kraj";25
47813482;"Základní škola, Opava, Havlíčkova 1, příspěvková organizace";"Moravskoslezský kraj";50
47813512;"Základní umělecká škola, Opava, příspěvková organizace";"Moravskoslezský kraj";50
47813539;"Základní umělecká škola Vladislava Vančury, Háj ve Slezsku, příspěvková organizace";"Moravskoslezský kraj";25
48134201;"Základní škola, Praha 2, Botičská 8";"Praha";25
48135143;"Základní umělecká škola, Praha 4 - Nusle, Lounských 4/129";"Praha";50
48161012;"Sportovní gymnázium, Pardubice, Dašická 268";"Pardubický kraj";25
48161161;"Střední průmyslová škola potravinářství a služeb Pardubice";"Pardubický kraj";25
48379794;"Domov sociálních služeb Liblín, příspěvková organizace";"Plzeňský kraj";50
48804894;"Domov Odry, příspěvková organizace";"Moravskoslezský kraj";50
48899097;"NOVOMĚSTSKÉ SOCIÁLNÍ SLUŽBY";"Kraj Vysočina";25
48954845;"Pečovatelská služba města Dobříše";"Středočeský kraj";6
49123947;"Výchovný ústav, středisko výchovné péče a střední škola Buškovice";"Ústecký kraj";50
49277600;"Česká centrála cestovního ruchu - CzechTourism";"Praha";50
49314670;"Gymnázium, Česká Třebová, Tyršovo náměstí 970";"Pardubický kraj";25
49314891;"Gymnázium Žamberk";"Pardubický kraj";25
49418823;"Základní škola Hodonín, Vančurova 2, příspěvková organizace";"Jihomoravský kraj";50
49466607;"Základní škola a Mateřská škola Brno, Milénova 14, příspěvková organizace";"Jihomoravský kraj";100
49625446;"Gymnázium, Praha 6, Nad Alejí 1952";"Praha";50
49748190;"Dům sociální péče Kralovice, příspěvková organizace";"Plzeňský kraj";50
49774859;"Odborná škola výroby a služeb, Plzeň, Vejprnická 56";"Plzeňský kraj";25
49778099;"Masarykovo gymnázium, Plzeň, Petákova 2";"Plzeňský kraj";50
60116935;"Masarykova obchodní akademie, Jičín, 17. listopadu 220";"Královéhradecký kraj";25
60153326;"Gymnázium a Střední odborná škola, Hostinné, Horská 309";"Královéhradecký kraj";25
60153385;"Výchovný ustav, střední škola a středisko výchovné péče, Hostinné";"Královéhradecký kraj";25
60165171;"Akademie věd České republiky";"Praha";100
60545992;"Střední škola průmyslová, technická a automobilní Jihlava";"Kraj Vysočina";100
60650737;"Dětský domov, Základní škola, Školní jídelna a Školní družina, Volyně, Školní 319";"Jihočeský kraj";25
60821221;"Střední odborná škola zdravotnická a Střední odborné učiliště, Český Krumlov, Tavírna 342";"Jihočeský kraj";25
60826801;"Teplárna Písek, a.s.";"Jihočeský kraj";100
61385271;"Gymnázium, Praha 5, Na Zatlance 11";"Praha";50
61716707;"Gymnázium Valašské Klobouky";"Zlínský kraj";25
61974757;"Dopravní podnik Ostrava a.s.";"Moravskoslezský kraj";2000
61985759;"Gymnázium Jana Blahoslava a Střední pedagogická škola, Přerov, Denisova 3";"Olomoucký kraj";50
61989991;"Základní škola Dr. Hrubého 2, Šternberk, příspěvková organizace";"Olomoucký kraj";50
62690001;"Dětský diagnostický ústav, středisko výchovné péče, základní škola a školní jídelna, Hradec Králové, Říčařova 277";"Královéhradecký kraj";100
63024616;"Střední škola, Základní škola a Mateřská škola, Karviná, příspěvková organizace";"Moravskoslezský kraj";50
63434504;"Základní škola a Mateřská škola Břeclav, Kpt. Nálepky 7, příspěvková organizace";"Jihomoravský kraj";25
63701332;"Dětský domov a Školní jídelna, Přerov, Sušilova 25";"Olomoucký kraj";20
64123421;"Městská knihovna Valašské Meziříčí, příspěvková organizace";"Zlínský kraj";10
64327809;"Základní škola při Fakultní nemocnici Brno, příspěvková organizace";"Jihomoravský kraj";25
64628795;"Městská knihovna Český Těšín";"Moravskoslezský kraj";25
65081803;"Základní umělecká škola, Varnsdorf, Národní 512, příspěvková organizace";"Ústecký kraj";25
65759800;"SPORTIS, příspěvková organizace";"Kraj Vysočina";50
65993390;"Ředitelství silnic a dálnic ČR";"Praha";2000
66289351;"Základní umělecká škola Broumov";"Královéhradecký kraj";25
67011748;"Mateřská škola, Základní škola a Praktická škola Znojmo, příspěvková organizace";"Jihomoravský kraj";50
67439241;"Základní umělecká škola, Náchod, Tyršova 247";"Královéhradecký kraj";25
67985823;"Fyziologický ústav AV ČR, v.v.i.";"Praha";500
67985831;"Geologický ústav AV ČR, v.v.i.";"Praha";100
67985874;"Ústav pro hydrodynamiku AV ČR, v.v.i.";"Praha";50
67985939;"Botanický ústav AV ČR, v.v.i.";"Středočeský kraj";250
69538549;"Městské kulturní a informační středisko v Humpolci";"Kraj Vysočina";10
70565813;"Státní ústav jaderné,chemické a biologické ochrany, v.v.i.";"Středočeský kraj";50
70631786;"Základní škola a mateřská škola Ostrava-Výškovice, Šeříková 33, příspěvková organizace";"Moravskoslezský kraj";50
70631808;"Čtyřlístek - centrum pro osoby se zdravotním postižením Ostrava, příspěvková organizace";"Moravskoslezský kraj";250
70631867;"Domov Korýtko, příspěvková organizace";"Moravskoslezský kraj";100
70838534;"Gymnázium a Střední odborná škola, Plasy";"Plzeňský kraj";50
70851042;"Domov pro seniory Burešov, příspěvková organizace";"Zlínský kraj";100
70856303;"Základní umělecká škola Josefa Slavíka, Hořovice, Palackého náměstí 253";"Středočeský kraj";20
70856788;"Státní fond rozvoje bydlení";"Praha";50
70878030;"Domov pro seniory Zahradní Město";"Praha";200
70886300;"Hasičský záchranný sbor Ústeckého kraje";"Ústecký kraj";500
70887276;"Domov pro seniory Vychodilova, příspěvková organizace";"Jihomoravský kraj";50
70890366;"Plzeňský kraj";"Plzeňský kraj";500
70919640;"Mateřská škola,Praha 8,Šiškova 2";"Praha";25
70923477;"Příspěvková organizace Městská sportovní zařízení v Litoměřicích";"Ústecký kraj";50
70947911;"Střední odborná škola waldorfská, Ostrava, příspěvková organizace";"Moravskoslezský kraj";10
70962642;"Dům kultury v Kroměříži, příspěvková organizace";"Zlínský kraj";25
70978352;"Základní škola a mateřská škola Ostrava - Bělský Les, B. Dvorského 1, příspěvková organizace";"Moravskoslezský kraj";50
70978956;"Státní oblastní archiv v Třeboni";"Jihočeský kraj";100
70979821;"Národní archiv";"Praha";100
70982333;"Městská knihovna Kyjov, příspěvková organizace města Kyjova";"Jihomoravský kraj";10
70984743;"Základní škola, Ostrava - Poruba, Porubská 832, příspěvková organizace";"Moravskoslezský kraj";50
70984794;"Základní škola, Ostrava - Poruba A. Hrdličky 1638, příspěvková organizace";"Moravskoslezský kraj";50
70999422;"Základní škola a mateřská škola Ostrava-Hošťálkovice, Výhledy 210, příspěvková organizace";"Moravskoslezský kraj";25
71009221;"Krajská hygienická stanice Zlínského kraje se sídlem ve Zlíně";"Zlínský kraj";100
71184601;"Domov bez zámku Náměšť nad Oslavou, příspěvková organizace";"Kraj Vysočina";50
71196234;"Základní škola Žďár nad Sázavou, Palachova 2189/35, příspěvková organizace";"Kraj Vysočina";50
71218840;"Centrum investic, rozvoje a inovací";"Královéhradecký kraj";50
71230629;"SOCIÁLNÍ SLUŽBY UHERSKÝ BROD, příspěvková organizace";"Zlínský kraj";25
71234918;"K-klub-středisko volného času, Jičín, Valdštejnovo nám. 99";"Královéhradecký kraj";10
71248234;"Správa majetku města Vyškova, příspěvková organizace";"Jihomoravský kraj";25
72038080;"RADA PRO VEŘEJNÝ DOHLED NAD AUDITEM";"Praha";25
72051612;"Krajské ředitelství policie Karlovarského kraje";"Karlovarský kraj";1500
72054506;"Správa základních registrů";"Praha";50
72063904;"Aquapark Uherské Hradiště,příspěvková organizace";"Zlínský kraj";25
72085428;"Střední škola zahradnická a technická Litomyšl";"Pardubický kraj";100
72556064;"Koordinátor Integrovaného dopravního systému Olomouckého kraje, příspěvková organizace";"Olomoucký kraj";20
72742348;"Mateřská škola \"Klubíčko\", Liberec, Jugoslávská 128/1, příspěvková organizace";"Liberecký kraj";10
72743301;"Mateřská škola \"Beruška\", Liberec, Na Pískovně 761/3, příspěvková organizace";"Liberecký kraj";10
72743379;"Základní škola, Liberec,Kaplického 384, příspěvková organizace";"Liberecký kraj";25
73184560;"Kulturní zařízení Ostrava-Jih, příspěvková organizace";"Moravskoslezský kraj";25
75004011;"Sociální služby pro seniory Šumperk, příspěvková organizace";"Olomoucký kraj";100
75004020;"Domov u Třebůvky Loštice, příspěvková organizace";"Olomoucký kraj";10
75007932;"Domov na zámku Bystré";"Pardubický kraj";100
75027135;"Základní škola a mateřská škola Hlučín-Darkovičky, příspěvková organizace";"Moravskoslezský kraj";20
75044498;"Dům dětí a mládeže, Prachatice, Ševčíkova 273";"Jihočeský kraj";25
75149541;"Domovy pro osoby se zdravotním postižením Ústí nad Labem, příspěvková organizace";"Ústecký kraj";100
75152304;"Záchranný útvar Hasičského záchranného sboru České republiky";"Moravskoslezský kraj";200
7536;"Palivový kombinát Ústí, státní podnik";"Ústecký kraj";250
20702;"Výzkumný ústav lesního hospodářství a myslivosti, v.v.i.";"Středočeský kraj";100
20729;"Státní fond životního prostředí České republiky";"Praha";500
24341;"Ministerstvo zdravotnictví";"Praha";500
24465;"Obvodní soud pro Prahu 9";"Praha";100
24724;"Okresní soud v Chebu";"Karlovarský kraj";100
24767;"Okresní soud Plzeň-jih";"Plzeňský kraj";50
24775;"Okresní soud Plzeň-sever";"Plzeňský kraj";50
24899;"Okresní soud v Mostě";"Ústecký kraj";100
24953;"Okresní soud v Chrudimi";"Pardubický kraj";50
25593;"ČESKÝ STATISTICKÝ ÚŘAD";"Praha";1000
26018;"Krajské státní zastupitelství v Praze";"Praha";250
26051;"KRAJSKÉ STÁTNÍ ZASTUPITELSTVÍ V HRADCI KRÁLOVÉ";"Královéhradecký kraj";200
27006;"Výzkumný ústav rostlinné výroby, v.v.i.";"Praha";250
64297;"Městská divadla pražská";"Praha";100
66451;"Technické služby města Mělníka, příspěvková organizace";"Středočeský kraj";25
69175;"Hotelová škola, Vyšší odborná škola hotelnictví a turismu a Jazyková škola s právem státní jazykové zkoušky, Poděbrady, Komenského 156/III";"Středočeský kraj";50
77461;"Integrovaná střední škola Cheb, příspěvková organizace";"Karlovarský kraj";100
89613;"Regionální muzeum v Mikulově, příspěvková organizace";"Jihomoravský kraj";25
93050;"KNIHOVNA MATĚJE JOSEFA SYCHRY, ŽĎÁR NAD SÁZAVOU";"Kraj Vysočina";10
96814;"Zoologická zahrada Olomouc, příspěvková organizace";"Olomoucký kraj";50
97381;"Technické služby Moravská Ostrava a Přívoz, p.o.";"Moravskoslezský kraj";100
97811;"Technické služby Lipník nad Bečvou, příspěvková organizace";"Olomoucký kraj";25
98892;"Fakultní nemocnice Olomouc";"Olomoucký kraj";4000
100340;"Střední odborná škola a Střední odborné učiliště podnikání a služeb, Jablunkov, Školní 416, příspěvková organizace";"Moravskoslezský kraj";25
100544;"Moravské divadlo Olomouc příspěvková organizace";"Olomoucký kraj";250
100609;"Vlastivědné muzeum v Olomouci";"Olomoucký kraj";50
179540;"Nemocnice Havlíčkův Brod, příspěvková organizace";"Kraj Vysočina";1000
216305;"Vysoké učení technické v Brně";"Jihomoravský kraj";3000
226912;"Nemocnice Kyjov, příspěvková organizace";"Jihomoravský kraj";1000
231126;"MĚSTSKÁ ČÁST PRAHA 11";"Praha";250
231207;"MĚSTSKÁ ČÁST PRAHA - LYSOLAJE";"Praha";6
231304;"MĚSTSKÁ ČÁST PRAHA 19";"Praha";100
231355;"MĚSTSKÁ ČÁST PRAHA 15";"Praha";100
233129;"Město Beroun";"Středočeský kraj";200
234516;"Statutární město Kladno";"Středočeský kraj";500
235440;"Město Kolín";"Středočeský kraj";250
239402;"Město Lysá nad Labem";"Středočeský kraj";100
240389;"Městská část Praha Křeslice";"Praha";6
240702;"Město Říčany";"Středočeský kraj";200
242098;"MĚSTO DOBŘÍŠ";"Středočeský kraj";100
253979;"Město Cheb";"Karlovarský kraj";250
254061;"Město Mariánské Lázně";"Karlovarský kraj";100
256986;"Město Nepomuk";"Plzeňský kraj";50
257125;"Město Přeštice";"Plzeňský kraj";100
261238;"Statutární město Děčín";"Ústecký kraj";250
272728;"Město Jaroměř";"Královéhradecký kraj";100
277444;"Město Svitavy";"Pardubický kraj";100
282481;"Město Rosice";"Jihomoravský kraj";100
283193;"Město Hustopeče";"Jihomoravský kraj";100
285455;"Město Veselí nad Moravou";"Jihomoravský kraj";100
295841;"Město Žďár nad Sázavou";"Kraj Vysočina";200
300063;"Město Hlučín";"Moravskoslezský kraj";100
300535;"Statutární město Opava";"Moravskoslezský kraj";500
302724;"Město Jeseník";"Olomoucký kraj";250
305847;"MUZEUM TĚŠÍNSKA, příspěvková organizace";"Moravskoslezský kraj";50
353566;"Městská správa kin v Kolíně";"Středočeský kraj";10
370941;"Regionální muzeum v Chrudimi";"Pardubický kraj";20
377945;"Domov mládeže a školní jídelna Mariánské Lázně, příspěvková organizace";"Karlovarský kraj";25
417688;"Technické služby města Nového Jičína, příspěvková organizace";"Moravskoslezský kraj";100
486639;"Městské kulturní středisko Holešov, příspěvková organizace";"Zlínský kraj";50
489557;"Správa bytového fondu města Vítkova, příspěvková organizace";"Moravskoslezský kraj";10
581119;"Střední zdravotnická škola a Vyšší odborná škola zdravotnická Havlíčkův Brod";"Kraj Vysočina";25
601152;"Střední zdravotnická škola, Opava, příspěvková organizace";"Moravskoslezský kraj";25
601233;"Rehabilitační ústav Hrabyně";"Moravskoslezský kraj";250
601683;"Základní škola a Mateřská škola logopedická Olomouc";"Olomoucký kraj";100
602132;"Střední průmyslová škola elektrotechniky a informatiky, Ostrava, příspěvková organizace";"Moravskoslezský kraj";50
637696;"Střední zdravotnická škola a Vyšší odborná škola zdravotnická Žďár nad Sázavou";"Kraj Vysočina";25
641111;"Vzdělávací institut Středočeského kraje - Zařízení pro další vzdělávání pedagogických pracovníků";"Středočeský kraj";25
663565;"Střední škola oděvního a grafického designu, Lysá nad Labem, Stržiště 475.";"Středočeský kraj";50
673552;"Psychiatrická nemocnice Horní Beřkovice";"Ústecký kraj";500
842001;"Nemocnice Nové Město na Moravě, příspěvková organizace";"Kraj Vysočina";1000
842737;"Gymnázium, Ostrava-Zábřeh, Volgogradská 6a, příspěvková organizace";"Moravskoslezský kraj";25
843989;"Fakultní nemocnice Ostrava";"Moravskoslezský kraj";3000
846325;"Domov pro seniory Krnov";"Moravskoslezský kraj";100
846678;"Knihovna Třinec, příspěvková organizace";"Moravskoslezský kraj";25
848298;"Základní škola a Mateřská škola Bílovec, Komenského 701/3, příspěvková organizace";"Moravskoslezský kraj";50
851400;"Kino Oko";"Olomoucký kraj";6
871982;"Správa lázeňských parků, příspěvková organizace";"Karlovarský kraj";50
1312774;"Státní pozemkový úřad";"Praha";1500
14451018;"Střední odborná škola a Střední odborné učiliště, Česká Lípa, 28. října 2707, příspěvková organizace";"Liberecký kraj";100
15028216;"Střední odborná škola a Střední odborné učiliště Lanškroun";"Pardubický kraj";50
15054080;"Centrum sociálních služeb a pomoci Chrudim";"Pardubický kraj";50
21551464;"Městská knihovna Třeboň";"Jihočeský kraj";6
25007017;"Technické služby města Liberce a.s.";"Liberecký kraj";100
25171127;"Tělovýchovná zařízení města Tábora s.r.o.";"Jihočeský kraj";25
25207636;"Lesy města Rokycan, s.r.o.";"Plzeňský kraj";25
25968726;"Městský bytový podnik Vysoké Mýto s.r.o.";"Pardubický kraj";10
25997556;"Zdravotnický holding Královéhradeckého kraje a.s.";"Královéhradecký kraj";10
26392054;"Vědeckotechnický park Plzeň, a.s.";"Plzeňský kraj";10
26418274;"7U s.r.o.";"Praha";50
27520536;"Nemocnice Pardubického kraje, a.s.";"Pardubický kraj";5000
27530981;"Královéhradecká lékárna a.s.";"Královéhradecký kraj";50
45243956;"LÉČEBNA DLOUHODOBĚ NEMOCNÝCH";"Praha";50
45246211;"Základní umělecká škola Jižní Město, Praha 4, Křtinská 673";"Praha";50
45671303;"Základní škola, Znojmo, náměstí Republiky 9";"Jihomoravský kraj";50
46746862;"Střední odborná škola, Liberec, Jablonecká 999, příspěvková organizace";"Liberecký kraj";50
46773495;"Střední škola pedagogická, hotelnictví a služeb, Litoměřice, příspěvková organizace";"Ústecký kraj";100
46790039;"Základní škola a Mateřská škola při Nemocnici, Kadaň, Chomutovská 1289";"Ústecký kraj";25
47114304;"Zdravotní pojišťovna ministerstva vnitra České republiky";"Praha";500
47151552;"Frýdecká skládka, a.s.";"Moravskoslezský kraj";100
47274468;"Domov Severka Jiříkov, příspěvková organizace";"Ústecký kraj";50
47308095;"KULTURA A SPORT CHOMUTOV s.r.o.";"Ústecký kraj";50
47558415;"Obchodní akademie, Střední pedagogická škola a Jazyková škola s právem státní jazykové zkoušky, Beroun, U Stadionu 486";"Středočeský kraj";50
47657651;"Základní škola a Mateřská škola Frenštát pod Radhoštěm, Tyršova 913, okres Nový Jičín";"Moravskoslezský kraj";50
47673036;"Revírní bratrská pokladna, zdravotní pojišťovna";"Moravskoslezský kraj";250
47934832;"Střední škola hotelová a služeb Kroměříž";"Zlínský kraj";100
48004537;"Základní škola a Mateřská škola Cihelní, Karviná, příspěvková organizace";"Moravskoslezský kraj";50
48136069;"Státní úřad pro jadernou bezpečnost";"Praha";200
48364282;"Dopravní podnik Karlovy Vary, a.s.";"Karlovarský kraj";250
48380156;"Základní umělecká škola, Rokycany, Jiráskova 181";"Plzeňský kraj";25
48549037;"Grantová agentura České republiky";"Praha";100
48623687;"JIRÁSKOVO GYMNÁZIUM, Náchod, Řezníčkova 451";"Královéhradecký kraj";50
48804525;"Zdravotnická záchranná služba Moravskoslezského kraje, příspěvková organizace";"Moravskoslezský kraj";1000
48895598;"Vyšší odborná škola a Střední průmyslová škola Žďár nad Sázavou";"Kraj Vysočina";100
49156608;"Základní škola Luhačovice, příspěvková organizace";"Zlínský kraj";50
49241494;"Podpůrný a garanční rolnický a lesnický fond, a.s.";"Praha";100
49334191;"Technické služby města Nový Bydžov";"Královéhradecký kraj";50
49366378;"CASRI - Vědecké a servisní pracoviště tělesné výchovy a sportu";"Praha";25
49453866;"Slovácké vodárny a kanalizace, a. s.";"Zlínský kraj";250
49459881;"Gymnázium Tišnov, příspěvková organizace";"Jihomoravský kraj";50
49467352;"Nejvyšší státní zastupitelství";"Jihomoravský kraj";100
49558595;"Středisko volného času Lipník nad Bečvou, příspěvková organizace";"Olomoucký kraj";10
49589792;"Gymnázium, Šumperk, Masarykovo náměstí 8";"Olomoucký kraj";50
49710371;"Řízení letového provozu České republiky, státní podnik (ŘLP ČR, s.p.)";"Středočeský kraj";1000
49778129;"Dětský diagnostický ústav, středisko výchovné péče, základní škola a školní jídelna, Plzeň, Karlovarská 67";"Plzeňský kraj";50
49872516;"Domov sociálních služeb Meziboří, příspěvková organizace";"Ústecký kraj";100
60108631;"Vodovody a kanalizace Pardubice,a.s.";"Pardubický kraj";250
60126698;"Střední průmyslová škola stavební akademika Stanislava Bechyně,Havlíčkův Brod, Jihlavská 628";"Kraj Vysočina";25
60153245;"Gymnázium, Vrchlabí, Komenského 586";"Královéhradecký kraj";25
60153393;"Gymnázium, Dvůr Králové nad Labem, nám. Odboje 304";"Královéhradecký kraj";25
60371731;"Obchodní akademie, Vyšší odborná škola a Jazyková škola s právem státní jazykové zkoušky Uherské Hradiště";"Zlínský kraj";50
60433272;"Základní škola, Praha 8, Žernosecká 3";"Praha";50
60444509;"Základní umělecká škola Jana Hanuše, Praha 6, U Dělnického cvičiště";"Praha";50
60461071;"Vysoká škola uměleckoprůmyslová v Praze";"Praha";100
60555530;"Vojenská nemocnice Brno";"Jihomoravský kraj";500
60680342;"Střední průmyslová škola Edvarda Beneše a Obchodní akademie Břeclav, příspěvková organizace";"Jihomoravský kraj";100
60733098;"Brněnské komunikace a.s.";"Jihomoravský kraj";250
60800691;"Vojenská nemocnice Olomouc";"Olomoucký kraj";500
60884690;"Střední škola zemědělská a ekologická a střední odborné učiliště chladicí a klimatizační techniky, Kostelec nad Orlicí";"Královéhradecký kraj";50
61222356;"Základní umělecká škola, Hradec Králové, Habrmanova 130";"Královéhradecký kraj";50
61379425;"Drážní úřad";"Praha";100
61385395;"Vyšší odborná škola sociálně právní";"Praha";25
61386871;"Vyšší odborná škola a Střední umělecká škola Václava Hollara, Praha 3, Hollarovo náměstí 2";"Praha";50
61388548;"Karlínská obchodní akademie a vyšší odborná škola ekonomická";"Praha";50
61388998;"ÚSTAV TERMOMECHANIKY AV ČR, v.v.i";"Praha";200
61515451;"Gymnázium, Teplice, Čs. dobrovolců 11, příspěvková organizace";"Ústecký kraj";50
61985911;"Domov Na zámečku Rokytnice, příspěvková organizace";"Olomoucký kraj";100
61988987;"Ostravská univerzita";"Moravskoslezský kraj";1000
62182137;"Zdravotnická záchranná služba Zlínského kraje, příspěvková organizace";"Zlínský kraj";250
62348337;"Základní škola, Ostrava-Poruba, Bulharská 1532, příspěvková organizace";"Moravskoslezský kraj";50
62690035;"Střední průmyslová škola stavební, Hradec Králové, Pospíšilova tř. 787";"Královéhradecký kraj";50
62690094;"Univerzita Hradec Králové";"Královéhradecký kraj";500
62913671;"Up Česká republika s.r.o.";"Praha";50
63699401;"Penzion pro seniory Frýdek-Místek, příspěvková organizace";"Moravskoslezský kraj";25
64123430;"Městská knihovna Rožnov pod Radhoštěm, příspěvková organizace";"Zlínský kraj";10
64627896;"Základní škola, Ostrava-Poruba, Ukrajinská 1533, příspěvková organizace";"Moravskoslezský kraj";25
64814467;"Technické služby města Jičína";"Královéhradecký kraj";100
65269705;"Fakultní nemocnice Brno";"Jihomoravský kraj";5000
65338090;"Regionální rozvojová agentura jižní Moravy";"Jihomoravský kraj";10
65642481;"Městská správa sociálních služeb Kadaň";"Ústecký kraj";100
66113334;"Mateřská škola \"V zahradě\", Liberec, Žitavská 122/68, příspěvková organizace";"Liberecký kraj";10
66185033;"Městská knihovna Bruntál";"Moravskoslezský kraj";10
66739721;"Mateřská škola Ostrava, Lechowiczova 8, příspěvková organizace";"Moravskoslezský kraj";20
67440479;"Základní umělecká škola Bohuslava Martinů Polička";"Pardubický kraj";25
67981801;"Ředitelství vodních cest ČR";"Praha";25
67985904;"Ústav živočišné fyziologie a genetiky AV ČR, v.v.i.";"Středočeský kraj";200
68081707;"Biofyzikální ústav AV ČR, v.v.i.";"Jihomoravský kraj";200
68081715;"Ústav analytické chemie AV ČR, v.v.i.";"Jihomoravský kraj";50
68378041;"Ústav experimentální medicíny AV ČR, v.v.i.";"Praha";200
68378068;"Ústav pro českou literaturu AV ČR, v.v.i.";"Praha";100
68378271;"Fyzikální ústav AV ČR, v.v.i.";"Praha";1000
68378289;"Ústav fyziky atmosféry AV ČR, v.v.i.";"Praha";100
68407700;"České vysoké učení technické v Praze";"Praha";5000
68975490;"AQUACENTRUM";"Ústecký kraj";25
69170754;"Technické služby města Přelouče";"Pardubický kraj";25
69781907;"Základní škola a mateřská škola Praha 5 - Smíchov, U Santošky 1/1007";"Praha";50
69793000;"Střední odborná škola a Střední odborné učiliště, Mladá Boleslav, Jičínská 762";"Středočeský kraj";50
